<?xml version="1.0" encoding="UTF-8"?>
<p:serviceConfiguration xmlns:p="http://globalgateway.mycorelogic.com/ServiceConfiguration" xmlns:xsi="http://www.w3.org/2001/XMLSchema-instance" xsi:schemaLocation="http://globalgateway.mycorelogic.com/ServiceConfiguration ../Schemas/ServiceConfiguration.xsd ">
  <p:service name="WF">
    <p:conversation>Async</p:conversation>
    <p:request>
      <p:action name="Submit" transform="y" validate="y">
        <p:input/>
      </p:action>
    </p:request>
    <p:reply>
      <p:action name="Recevied" transform="y" validate="y">
        <p:input/>
      </p:action>
    </p:reply>
  </p:service>
</p:serviceConfiguration>
